{"schema_version":"1.0.0","case_id":"case-demo-20260927","network":"bitcoin-regtest","txid":"1111111111111111111111111111111111111111111111111111111111111111","record_variant":"canonical","block_hash":null,"block_height":null,"block_time":"2026-01-01T00:00:00Z","block_time_original":"2026-01-01T00:00:00Z","fee_sats":250,"confirmation_status":"unknown","source_refs":[{"evidence_id":"ev-demo-transactions","source_sha256":"0000000000000000000000000000000000000000000000000000000000000000","locator_type":"synthetic","locator":"transaction:0","byte_start":null,"byte_end":null}]}
